[
  {
    "id": "terrain.bog-deadwood",
    "name": "Gallows Deadwood",
    "rulesType": "forest",
    "footprint": {
      "polygon": [
        {
          "x": 3,
          "z": 0
        },
        {
          "x": 2.598,
          "z": 1.125
        },
        {
          "x": 1.5,
          "z": 1.949
        },
        {
          "x": 0,
          "z": 2.25
        },
        {
          "x": -1.5,
          "z": 1.949
        },
        {
          "x": -2.598,
          "z": 1.125
        },
        {
          "x": -3,
          "z": 0
        },
        {
          "x": -2.598,
          "z": -1.125
        },
        {
          "x": -1.5,
          "z": -1.949
        },
        {
          "x": 0,
          "z": -2.25
        },
        {
          "x": 1.5,
          "z": -1.949
        },
        {
          "x": 2.598,
          "z": -1.125
        }
      ]
    },
    "height": 4,
    "mesh": "wt-bog-deadwood"
  },
  {
    "id": "terrain.bog-stilt-hut",
    "name": "Crooked Stilt Hut",
    "rulesType": "building",
    "footprint": {
      "rect": {
        "w": 4,
        "d": 4
      }
    },
    "height": 4.5,
    "mesh": "wt-bog-stilt-hut"
  },
  {
    "id": "terrain.bog-hummock",
    "name": "Mossy Hummock",
    "rulesType": "hill",
    "footprint": {
      "polygon": [
        {
          "x": 3.5,
          "z": 0
        },
        {
          "x": 3.031,
          "z": 1.25
        },
        {
          "x": 1.75,
          "z": 2.165
        },
        {
          "x": 0,
          "z": 2.5
        },
        {
          "x": -1.75,
          "z": 2.165
        },
        {
          "x": -3.031,
          "z": 1.25
        },
        {
          "x": -3.5,
          "z": 0
        },
        {
          "x": -3.031,
          "z": -1.25
        },
        {
          "x": -1.75,
          "z": -2.165
        },
        {
          "x": 0,
          "z": -2.5
        },
        {
          "x": 1.75,
          "z": -2.165
        },
        {
          "x": 3.031,
          "z": -1.25
        }
      ]
    },
    "height": 1,
    "mesh": "wt-bog-hummock"
  },
  {
    "id": "terrain.bog-log-barrier",
    "name": "Fallen Log Barrier",
    "rulesType": "obstacle",
    "footprint": {
      "rect": {
        "w": 4,
        "d": 0.75
      }
    },
    "height": 0.75,
    "mesh": "wt-bog-log-barrier"
  },
  {
    "id": "terrain.bog-murk-pool",
    "name": "Murk Pool",
    "rulesType": "shallowWater",
    "footprint": {
      "polygon": [
        {
          "x": 2.5,
          "z": 0
        },
        {
          "x": 2.165,
          "z": 0.875
        },
        {
          "x": 1.25,
          "z": 1.516
        },
        {
          "x": 0,
          "z": 1.75
        },
        {
          "x": -1.25,
          "z": 1.516
        },
        {
          "x": -2.165,
          "z": 0.875
        },
        {
          "x": -2.5,
          "z": 0
        },
        {
          "x": -2.165,
          "z": -0.875
        },
        {
          "x": -1.25,
          "z": -1.516
        },
        {
          "x": 0,
          "z": -1.75
        },
        {
          "x": 1.25,
          "z": -1.516
        },
        {
          "x": 2.165,
          "z": -0.875
        }
      ]
    },
    "height": 0,
    "mesh": "wt-bog-murk-pool"
  },
  {
    "id": "terrain.bog-bone-mire",
    "name": "Bone-Strewn Mire",
    "rulesType": "rough",
    "footprint": {
      "polygon": [
        {
          "x": 2.5,
          "z": 0
        },
        {
          "x": 2.165,
          "z": 1
        },
        {
          "x": 1.25,
          "z": 1.732
        },
        {
          "x": 0,
          "z": 2
        },
        {
          "x": -1.25,
          "z": 1.732
        },
        {
          "x": -2.165,
          "z": 1
        },
        {
          "x": -2.5,
          "z": 0
        },
        {
          "x": -2.165,
          "z": -1
        },
        {
          "x": -1.25,
          "z": -1.732
        },
        {
          "x": 0,
          "z": -2
        },
        {
          "x": 1.25,
          "z": -1.732
        },
        {
          "x": 2.165,
          "z": -1
        }
      ]
    },
    "height": 0,
    "mesh": "wt-bog-bone-mire"
  },
  {
    "id": "terrain.bog-stumps",
    "name": "Mossy Stump Cluster",
    "rulesType": "rubble",
    "footprint": {
      "polygon": [
        {
          "x": 2,
          "z": 0
        },
        {
          "x": 1.732,
          "z": 0.75
        },
        {
          "x": 1,
          "z": 1.299
        },
        {
          "x": 0,
          "z": 1.5
        },
        {
          "x": -1,
          "z": 1.299
        },
        {
          "x": -1.732,
          "z": 0.75
        },
        {
          "x": -2,
          "z": 0
        },
        {
          "x": -1.732,
          "z": -0.75
        },
        {
          "x": -1,
          "z": -1.299
        },
        {
          "x": 0,
          "z": -1.5
        },
        {
          "x": 1,
          "z": -1.299
        },
        {
          "x": 1.732,
          "z": -0.75
        }
      ]
    },
    "height": 0.5,
    "mesh": "wt-bog-stumps"
  }
]
