[
  {
    "id": "terrain.low-wall",
    "name": "Low Stone Wall",
    "rulesType": "obstacle",
    "footprint": {
      "rect": {
        "w": 4,
        "d": 0.75
      }
    },
    "height": 0.75,
    "verify": "Height 0.75 assumed (obstacle, below 1 inch)."
  },
  {
    "id": "terrain.pond",
    "name": "Shallow Pond",
    "rulesType": "shallowWater",
    "footprint": {
      "polygon": [
        {
          "x": 0.75,
          "z": -1
        },
        {
          "x": 1.457,
          "z": -0.707
        },
        {
          "x": 1.75,
          "z": 0
        },
        {
          "x": 1.457,
          "z": 0.707
        },
        {
          "x": 0.75,
          "z": 1
        },
        {
          "x": -0.75,
          "z": 1
        },
        {
          "x": -1.457,
          "z": 0.707
        },
        {
          "x": -1.75,
          "z": 0
        },
        {
          "x": -1.457,
          "z": -0.707
        },
        {
          "x": -0.75,
          "z": -1
        }
      ]
    },
    "height": 0
  }
]
